<?xml version="1.0" encoding="UTF-8"?>
<pairings:pairings
    xmlns:pairings="https://github.com/stephanheinemann/pairings/tree/master/src/main/resources/xsd"
    xmlns:xsi="http://www.w3.org/2001/XMLSchema-instance"
    xsi:schemaLocation="https://github.com/stephanheinemann/pairings/tree/master/src/main/resources/xsd ../../../main/resources/xsd/pairings.xsd "
    validFrom="2024-04-01" validTo="2024-04-30">
    <pairings:pairing timeAwayFromBase="PT5H28M" pairingAnnotation="OptimizedLock" perDiem="41.87"
        pairing="E007" base="Edmonton" trip="8" credit="PT4H" creditAnnotation="DutyValue">
        <pairings:crew captains="1" firstOfficers="1" extraFlightAttendants="0" flightAttendants="0" />
        <pairings:inidialDutyDays>
            <pairings:dutyDay date="2024-04-29" weekday="Monday" />
        </pairings:inidialDutyDays>
        <pairings:dutyDays>
            <pairings:dutyDay sequence="1">
                <pairings:duty>
                    <pairings:checkin out="06:55:00" timeOnGround="PT1H" report="true"
                        dutyAnnotation="MorningDuty" />
                    <pairings:leg in="08:42:00" destination="YYJ" origin="YEG" out="07:55:00"
                        block="PT1H47M" credit="PT1H47M" xsi:type="pairings:FlightLeg" operating="true"
                        airline="WestJet Airlines" number="413" timeOnGround="PT0H48M"
                        aircraft="Boeing 737-800 Winglets">
                        <pairings:crew captains="1" firstOfficers="1" extraFlightAttendants="1"
                            flightAttendants="3" />
                    </pairings:leg>
                    <pairings:leg in="12:08:00" destination="YEG" origin="YYJ" out="09:30:00"
                        block="PT1H38M" credit="PT1H38M" xsi:type="pairings:FlightLeg" number="416"
                        aircraft="Boeing 737-800 Winglets" operating="true" airline="WestJet Airlines">
                        <pairings:crew captains="1" firstOfficers="1" extraFlightAttendants="1"
                            flightAttendants="3" />
                    </pairings:leg>
                    <pairings:checkout in="12:23:00" duty="PT5H28M" timeOnGround="P15M"
                        block="PT3H25M" credit="PT4H" release="true" creditAnnotation="MinimumValue" />
                </pairings:duty>
            </pairings:dutyDay>
        </pairings:dutyDays>
    </pairings:pairing>
</pairings:pairings>
